ID,ASSESSMENT_QUALITY_TYPE_ID,CONTENT_EN_US,CONTENT_ZH_CN,CONTENT_ZH_TW,CONTENT_ID_ID,CONTENT_JA_JP,CONTENT_MS_MY,CONTENT_TH_TH,CONTENT_VI_VN,CONTENT_KO_KR,QUESTION_TYPE,MIN_VALUE,MAX_VALUE,IS_REVERSED,CREATED_BY,CREATED_DATE,UPDATED_BY,UPDATED_DATE,IS_DELETED,QUALITY_TYPE,VALUE_RATE
58,2,I feel others' emotions.,I feel others' emotions.,I feel others' emotions.,I feel others' emotions.,I feel others' emotions.,I feel others' emotions.,I feel others' emotions.,I feel others' emotions.,I feel others' emotions.,1,1,5,0,NULL,26-NOV-18 05.45.08.282000000 PM,NULL,26-NOV-18 05.45.08.282000000 PM,0,2,1
59,1,I follow a schedule.,I follow a schedule.,I follow a schedule.,I follow a schedule.,I follow a schedule.,I follow a schedule.,I follow a schedule.,I follow a schedule.,I follow a schedule.,1,1,5,0,NULL,26-NOV-18 05.45.08.282000000 PM,NULL,26-NOV-18 05.45.08.282000000 PM,0,3,1
60,4,I get irritated easily.,I get irritated easily.,I get irritated easily.,I get irritated easily.,I get irritated easily.,I get irritated easily.,I get irritated easily.,I get irritated easily.,I get irritated easily.,1,1,5,0,NULL,26-NOV-18 05.45.08.282000000 PM,NULL,26-NOV-18 05.45.08.282000000 PM,0,4,-1
61,3,I spend time reflecting on things.,I spend time reflecting on things.,I spend time reflecting on things.,I spend time reflecting on things.,I spend time reflecting on things.,I spend time reflecting on things.,I spend time reflecting on things.,I spend time reflecting on things.,I spend time reflecting on things.,1,1,5,0,NULL,26-NOV-18 05.45.08.282000000 PM,NULL,26-NOV-18 05.45.08.282000000 PM,0,5,1
62,5,I am quiet around strangers.,I am quiet around strangers.,I am quiet around strangers.,I am quiet around strangers.,I am quiet around strangers.,I am quiet around strangers.,I am quiet around strangers.,I am quiet around strangers.,I am quiet around strangers.,1,1,5,0,NULL,26-NOV-18 05.45.08.282000000 PM,NULL,26-NOV-18 05.45.08.282000000 PM,0,1,-1
63,2,I make people feel at ease.,I make people feel at ease.,I make people feel at ease.,I make people feel at ease.,I make people feel at ease.,I make people feel at ease.,I make people feel at ease.,I make people feel at ease.,I make people feel at ease.,1,1,5,0,NULL,26-NOV-18 05.45.08.282000000 PM,NULL,26-NOV-18 05.45.08.282000000 PM,0,2,1
64,1,I am exacting in my work.,I am exacting in my work.,I am exacting in my work.,I am exacting in my work.,I am exacting in my work.,I am exacting in my work.,I am exacting in my work.,I am exacting in my work.,I am exacting in my work.,1,1,5,0,NULL,26-NOV-18 05.45.08.282000000 PM,NULL,26-NOV-18 05.45.08.282000000 PM,0,3,1
65,4,I often feel blue.,I often feel blue.,I often feel blue.,I often feel blue.,I often feel blue.,I often feel blue.,I often feel blue.,I often feel blue.,I often feel blue.,1,1,5,0,NULL,26-NOV-18 05.45.08.282000000 PM,NULL,26-NOV-18 05.45.08.282000000 PM,0,4,-1
66,3,I am full of ideas.,I am full of ideas.,I am full of ideas.,I am full of ideas.,I am full of ideas.,I am full of ideas.,I am full of ideas.,I am full of ideas.,I am full of ideas.,1,1,5,0,NULL,26-NOV-18 05.45.08.282000000 PM,NULL,26-NOV-18 05.45.08.282000000 PM,0,5,1